{
  "$schema": "./tokens.schema.json",
  "adapters": {
    "android-ime": {
      "format": "kotlin",
      "output": "commandglows_app/android/app/src/main/kotlin/com/commandglows/app/ime/generated/CommandGlowsTokens.kt",
      "status": "active",
      "tokens": [
        "semantic.color.keyboard.key.active",
        "semantic.color.keyboard.key.foreground",
        "semantic.motion.keyboard.press",
        "semantic.space.unit"
      ]
    },
    "email": {
      "format": "typescript",
      "output": "commandglows_site/src/theme/generated/email-tokens.ts",
      "status": "active",
      "tokens": [
        "component.email.button.background",
        "component.email.button.radius",
        "semantic.space.unit",
        "semantic.typography.body.family"
      ]
    },
    "extension": {
      "format": "extension-css",
      "output": "ext/src/generated/commandglows-tokens.css",
      "status": "active",
      "tokens": [
        "primitive.color.neutral.black",
        "semantic.color.brand.logo.cyan",
        "semantic.color.brand.logo.red",
        "semantic.color.brand.website",
        "semantic.space.unit",
        "semantic.typography.body.family"
      ]
    },
    "flutter": {
      "format": "dart",
      "output": "commandglows_app/lib/core/theme/generated/commandglows_tokens.g.dart",
      "status": "active",
      "tokens": [
        "semantic.color.keyboard.key.active",
        "semantic.color.keyboard.key.foreground",
        "semantic.motion.keyboard.press",
        "semantic.space.unit",
        "semantic.typography.body.family"
      ]
    },
    "resolved-matrix": {
      "format": "resolved-json",
      "output": "design-system/resolved-values.json",
      "status": "active",
      "tokens": []
    },
    "site": {
      "format": "css",
      "output": "commandglows_site/src/assets/styles/generated/commandglows-tokens.css",
      "status": "active",
      "tokens": [
        "primitive.color.neutral.black",
        "primitive.color.neutral.white",
        "semantic.color.brand.logo.cyan",
        "semantic.color.brand.logo.green",
        "semantic.color.brand.logo.magenta",
        "semantic.color.brand.logo.red",
        "semantic.color.brand.logo.violet",
        "semantic.color.brand.logo.yellow",
        "semantic.color.brand.website",
        "semantic.space.unit",
        "semantic.typography.body.family",
        "semantic.color.workspace.canvas.light",
        "semantic.color.workspace.canvas.dark",
        "semantic.color.workspace.surface.light",
        "semantic.color.workspace.surface.dark",
        "semantic.color.workspace.border.light",
        "semantic.color.workspace.border.dark",
        "semantic.color.workspace.text.light",
        "semantic.color.workspace.text.dark",
        "semantic.color.workspace.muted.light",
        "semantic.color.workspace.muted.dark",
        "semantic.color.workspace.accent.light",
        "semantic.color.workspace.accent.dark",
        "semantic.motion.workspace.feedback",
        "semantic.motion.workspace.route",
        "semantic.motion.workspace.ease",
        "semantic.layout.workspace.sidebar",
        "semantic.layout.workspace.maximum",
        "semantic.layout.workspace.header",
        "semantic.radius.workspace.panel",
        "semantic.radius.workspace.control"
      ]
    }
  },
  "description": "Structural unification of current CommandGlows token authorities without an intentional visual change.",
  "layers": {
    "component": {
      "email.button.background": {
        "type": "color",
        "value": "{semantic.color.brand.website}"
      },
      "email.button.radius": {
        "type": "dimension",
        "value": "{semantic.radius.email.action}"
      },
      "keyboard.key.active.background": {
        "type": "color",
        "value": "{semantic.color.keyboard.key.active}"
      },
      "keyboard.key.foreground": {
        "type": "color",
        "value": "{semantic.color.keyboard.key.foreground}"
      },
      "keyboard.key.press.duration": {
        "type": "duration",
        "value": "{semantic.motion.keyboard.press}"
      }
    },
    "primitive": {
      "color.app.action.dark": {
        "type": "color",
        "value": "#fcfcfc"
      },
      "color.app.action.light": {
        "type": "color",
        "value": "#262626"
      },
      "color.brand.cyan": {
        "type": "color",
        "value": "#00c8ff"
      },
      "color.brand.green": {
        "type": "color",
        "value": "#00ff44"
      },
      "color.brand.magenta": {
        "type": "color",
        "value": "#ff00c8"
      },
      "color.brand.red": {
        "type": "color",
        "value": "#ff0033"
      },
      "color.brand.violet": {
        "type": "color",
        "value": "#7c3cff"
      },
      "color.brand.yellow": {
        "type": "color",
        "value": "#ffe500"
      },
      "color.ime.key.active": {
        "type": "color",
        "value": "#17795d"
      },
      "color.ime.key.foreground": {
        "type": "color",
        "value": "#1d2320"
      },
      "color.neutral.black": {
        "type": "color",
        "value": "#000000"
      },
      "color.neutral.white": {
        "type": "color",
        "value": "#ffffff"
      },
      "color.workspace.accent.dark": {
        "type": "color",
        "value": "#ff82df"
      },
      "color.workspace.accent.light": {
        "type": "color",
        "value": "#a80080"
      },
      "color.workspace.border.dark": {
        "type": "color",
        "value": "#30333d"
      },
      "color.workspace.border.light": {
        "type": "color",
        "value": "#e3e5eb"
      },
      "color.workspace.canvas.dark": {
        "type": "color",
        "value": "#101115"
      },
      "color.workspace.canvas.light": {
        "type": "color",
        "value": "#f6f7f9"
      },
      "color.workspace.muted.dark": {
        "type": "color",
        "value": "#a3a7b4"
      },
      "color.workspace.muted.light": {
        "type": "color",
        "value": "#616575"
      },
      "color.workspace.surface.dark": {
        "type": "color",
        "value": "#191b21"
      },
      "color.workspace.surface.light": {
        "type": "color",
        "value": "#ffffff"
      },
      "color.workspace.text.dark": {
        "type": "color",
        "value": "#f1f2f5"
      },
      "color.workspace.text.light": {
        "type": "color",
        "value": "#20232c"
      },
      "dimension.radius.email.action": {
        "type": "dimension",
        "value": {
          "amount": 10,
          "unit": "px"
        }
      },
      "dimension.space.1": {
        "type": "dimension",
        "value": {
          "amount": 4,
          "unit": "px"
        }
      },
      "duration.keyboard.press": {
        "type": "duration",
        "value": {
          "amount": 170,
          "unit": "ms"
        }
      },
      "font.body": {
        "description": "Site-first canonical body stack; platforms register physical-font delivery adaptations.",
        "type": "fontFamily",
        "value": [
          "Manrope",
          "sans-serif"
        ]
      },
      "layout.workspace.header": {
        "type": "dimension",
        "value": {
          "amount": 72,
          "unit": "px"
        }
      },
      "layout.workspace.maximum": {
        "type": "dimension",
        "value": {
          "amount": 1440,
          "unit": "px"
        }
      },
      "layout.workspace.sidebar": {
        "type": "dimension",
        "value": {
          "amount": 232,
          "unit": "px"
        }
      },
      "motion.workspace.ease": {
        "type": "cubicBezier",
        "value": [
          0.2,
          0,
          0,
          1
        ]
      },
      "motion.workspace.feedback": {
        "type": "duration",
        "value": {
          "amount": 160,
          "unit": "ms"
        }
      },
      "motion.workspace.route": {
        "type": "duration",
        "value": {
          "amount": 180,
          "unit": "ms"
        }
      },
      "radius.workspace.control": {
        "type": "dimension",
        "value": {
          "amount": 10,
          "unit": "px"
        }
      },
      "radius.workspace.panel": {
        "type": "dimension",
        "value": {
          "amount": 16,
          "unit": "px"
        }
      }
    },
    "semantic": {
      "color.brand.logo.cyan": {
        "status": "active",
        "type": "color",
        "value": "{primitive.color.brand.cyan}"
      },
      "color.brand.logo.green": {
        "status": "active",
        "type": "color",
        "value": "{primitive.color.brand.green}"
      },
      "color.brand.logo.magenta": {
        "status": "active",
        "type": "color",
        "value": "{primitive.color.brand.magenta}"
      },
      "color.brand.logo.red": {
        "status": "active",
        "type": "color",
        "value": "{primitive.color.brand.red}"
      },
      "color.brand.logo.violet": {
        "status": "active",
        "type": "color",
        "value": "{primitive.color.brand.violet}"
      },
      "color.brand.logo.yellow": {
        "status": "active",
        "type": "color",
        "value": "{primitive.color.brand.yellow}"
      },
      "color.brand.website": {
        "status": "active",
        "type": "color",
        "value": "{primitive.color.brand.magenta}"
      },
      "color.keyboard.key.active": {
        "status": "active",
        "type": "color",
        "value": "{primitive.color.ime.key.active}"
      },
      "color.keyboard.key.foreground": {
        "status": "active",
        "type": "color",
        "value": "{primitive.color.ime.key.foreground}"
      },
      "color.workspace.accent.dark": {
        "status": "active",
        "type": "color",
        "value": "{primitive.color.workspace.accent.dark}"
      },
      "color.workspace.accent.light": {
        "status": "active",
        "type": "color",